COD,FRASES,TP_ACOES
1,"No princípio dos tempos, antes mesmo da existência da vida, os ancestrais surgiram com poderes absolutos.",Narrativa
2,Cada ancestral deu origem a uma raça que serviria e cuidaria de suas criações.,Narrativa
3,"Com o tempo, porém, alguns ancestrais se corromperam, trazendo desordem e caos ao mundo que haviam criado.",Narrativa
4,As raças fiéis lutaram contra os ancestrais corrompidos para proteger o equilíbrio e a harmonia das criações.,Narrativa
5,"A batalha entre as raças e os ancestrais corrompidos moldou o destino do mundo, deixando cicatrizes e lendas que ecoariam através das eras.",Narrativa
